{
  "$schema": "https://json-schema.org/draft/2020-12/schema",
  "$id": "urn:promptobus:v1:participant",
  "title": "Participant",
  "description": "A protocol v1 task participant. The ID is independent; the role is declared as its own field, not derived from the ID.",
  "type": "object",
  "additionalProperties": false,
  "required": ["id", "role", "harness", "mode", "sessionRef", "capabilities", "metadata"],
  "properties": {
    "id": {
      "description": "The participant's independent ID. A role is never derived from it.",
      "type": "string",
      "pattern": "^[a-z0-9][a-z0-9-]{0,63}$"
    },
    "role": {
      "description": "An extensible role slug: the core does not keep a list of roles.",
      "type": "string",
      "pattern": "^[a-z][a-z0-9-]{0,31}$"
    },
    "harness": {
      "description": "The tool the participant's session lives in. Required: v1 has no fallback.",
      "type": "string",
      "pattern": "^[a-z][a-z0-9-]{0,31}$"
    },
    "mode": {
      "description": "managed — the driver spawned the session; attached — it connected on its own.",
      "enum": ["managed", "attached"]
    },
    "sessionRef": {
      "description": "The driver's opaque session reference. An explicit null, not a missing field.",
      "type": ["string", "null"],
      "minLength": 1
    },
    "capabilities": {
      "description": "A snapshot of the driver's capabilities at spawn time. The last six fields are optional: older records without them sit in live journals and must remain readable.",
      "type": ["object", "null"],
      "additionalProperties": false,
      "required": ["spawn", "attach", "activation", "inspect", "stop"],
      "properties": {
        "spawn": { "type": "boolean" },
        "attach": { "type": "boolean" },
        "activation": { "enum": ["push", "pull"] },
        "inspect": { "type": "boolean" },
        "stop": { "type": "boolean" },
        "denyTools": { "type": "boolean" },
        "mcpDenyTools": { "type": "boolean" },
        "systemPrompt": { "type": "boolean" },
        "sessionList": { "type": "boolean" },
        "enter": { "type": "boolean" },
        "approverLift": { "type": "boolean" }
      }
    },
    "metadata": {
      "description": "The adapter's metadata: the core never looks inside it.",
      "type": "object"
    }
  }
}
