{
  "id": "aaaaaaaaaaaaaaaaaaaaaaaaaaaaaaaaaaaaaaaaaaaaaaaaaaaaaaaaaaaaaaaa",
  "role": "worker",
  "harness": "fake",
  "mode": "managed",
  "sessionRef": "sess-boundary",
  "capabilities": {
    "spawn": true,
    "attach": true,
    "activation": "push",
    "inspect": true,
    "stop": true
  },
  "metadata": {}
}
